{
  "schema_version": 1,
  "project": "harness-demo",
  "created": "2026-10-08T00:00:00+08:00",
  "updated": "2026-10-08T00:00:00+08:00",
  "smoke_cmd": "python wordcount.py README.md",
  "notes": "自包含示例：不联网、不跑 GPU，只做本地文件操作。",
  "features": [
    {
      "id": "f1-count-words",
      "desc": "wordcount.py <file> 打印该文件词数到 stdout，正常退出码 0",
      "passes": false,
      "evidence": null,
      "verified_at": null,
      "notes": ""
    },
    {
      "id": "f2-empty-file",
      "desc": "空文件输入时打印 0（不报错、不抛异常）",
      "passes": false,
      "evidence": null,
      "verified_at": null,
      "notes": ""
    },
    {
      "id": "f3-top-n",
      "desc": "支持 --top N：打印出现次数最高的 N 个词（降序）",
      "passes": false,
      "evidence": null,
      "verified_at": null,
      "notes": ""
    }
  ]
}
